Sheet: XPTO ENGENHARIA.xml
A1: XPTO ENGENHARIA
A2: Orçamento
A4: PRODUTO | B4: DESCRIÇÃO | C4: VALOR | D4: QTD | E4: SITE | F4: VALOR FINAL
B5: HARDWARE
A6: NOTEBOOK DELL: | B6: 11ª geração Intel® Core™ i5-1135G7 (4-core, cache de 8MB, até 4.2GHz) | C6: 3398 | D6: 2 | E6: dell.com | F6: = RC[-3] * RC[-2] -> 6796
A7: PROCESSADOR: | B7: Intel Core i3-10105F, 3.7GHz (4.4GHz Max Turbo), Cache 6MB, Quad Core, 8 Thread, LGA 1200 | C7: 428.99 | D7: 3 | E7: pichau.com | F7: =RC[-3] * RC[-2] -> 1286.97
A8: PLACA MÃE: | B8: Alphard B560M-T, DDR4, SOCKET LGA 1200 | C8: 499.9 | D8: 3 | E8: kabum.com | F8: =RC[-3] * RC[-2] -> 1499.6999999999998
A9: PLACA DE VIDEO: | B9: T400 PNY NVIDIA, 4GB, GDDR6, PCIe 3.0 | C9: 919.99 | D9: 3 | E9: kabum.com | F9: =RC[-3] * RC[-2] -> 2759.9700000000003
A10: MEMÓRIA RAM: | B10: 8GB (1X8), DDR4, 3200MHZ, C16 | C10: 139.99 | D10: 3 | E10: pichau.com | F10: =RC[-3] * RC[-2] -> 419.97
A11: HD: | B11: HD WD Blue 2TB 3.5" Sata III 6GB/s | C11: 228.99 | D11: 3 | E11: kabum.com | F11: =RC[-3] * RC[-2] -> 686.97
A12: SSD: | B12: SD TGT Egon T2, 120GB, Sata III 6GB/s, Leitura 530 MB/s, Gravacao 490 MB/s | C12: 64.900000000000006 | D12: 3 | E12: pichau.com | F12: =RC[-3] * RC[-2] -> 194.70000000000002
A13: FONTE: | B13: MANCER THUNDER 500W, 80 PLUS BRONZE, MCR-THR500-BL01-OEM | C13: 249.99 | D13: 3 | E13: pichau.com | F13: =RC[-3] * RC[-2] -> 749.97
A14: GABINETE: | B14: Pichau HX300M Glass, Mid-tower, Lateral de Vidro, Preto, PG-HX3-BKM01 | C14: 159.9 | D14: 3 | E14: pichau.com | F14: =RC[-3] * RC[-2] -> 479.70000000000005
A15: KIT MOUSE E TECLADO: | B15: OFFICE TGT GR100 V2, ABNT2, 1200DPI, PRETO | C15: 84.92 | D15: 3 | E15: kabum.com | F15: =RC[-3] * RC[-2] -> 254.76
A16: MONITOR: | B16: Monitor 19.5" LED Widescreen 75Hz HDMI HQ Pro LED VESA | C16: 293.89999999999998 | D16: 3 | E16: magazineluiza.com | F16: =RC[-3] * RC[-2] -> 881.69999999999993
A17: DATASHOW: | B17: Projetor Epson Powerlite E20 3LCD, XGA, 3.400 Lumens, Conexão HDMI, Bivolt | C17: 3599 | D17: 1 | E17: kabum.com | F17: =RC[-3] * RC[-2] -> 3599
A18: IMPRESSORA: | B18: HP Laserjet PRO M428FDW, Laser, Mono, Wi-Fi, 110V, Branco | C18: 2939.99 | D18: 1 | E18: kabum.com | F18: =RC[-3] * RC[-2] -> 2939.99
B19: SOFTWARE
A20: AUTOCAD: | B20: Licensa Anual | C20: 7423 | D20: 4 | E20: autodesk.com | F20: =RC[-3] * RC[-2] -> 29692
A21: INVENTOR: | B21: Licensa Anual | C21: 8825 | D21: 4 | E21: autodesk.com | F21: =RC[-3] * RC[-2] -> 35300
A22: WINDOWS: | B22: Windows 11 Pro, 64 bits, Coem - Fqc - 10520 | C22: 840.65 | D22: 5 | E22: kabum.com | F22: =RC[-3] * RC[-2] -> 4203.25
A23: SERVIDOR: | B23: NAS Assustor A6530 40TB Intel Quad-Core, 1,5GHz 4GB DDR4 | C23: 17000 | D23: 1 | E23: fourserv.com | F23: =RC[-3] * RC[-2] -> 17000
B24: CONTRATO DE MANUTENÇÃO
A25: MANUTENÇÃO: | B25: Contrato Anual | C25: 17000 | F25: =RC[-3] -> 17000
A27: TOTAL: | F27: =SUM(R[-21]C:R[-2]C) -> 125744.65